question,answer
What is the API for usage monitoring?,"REST API available for enterprise accounts. Endpoints for usage, billing, line management. API documentation in developer portal. Rate limits apply."
How do I get API credentials?,"Request API access via corporate admin portal. Credentials issued within 48 hours. Sandbox environment available for testing."
What is number masking for business?,"Mask agent numbers during customer calls. Virtual number displayed instead. Call recordings linked to masked sessions. Available for enterprise accounts."
How do I set up IVR for business?,"IVR setup through enterprise portal. Upload audio prompts, configure menu options, set routing rules. Charges based on concurrent call capacity."
What is the toll-free number service?,"Toll-free numbers (1800) available for business. Caller pays nothing, business pays per-minute rate. Setup fee plus monthly rental applies."
Can I get a vanity toll-free number?,"Vanity toll-free numbers (easy to remember patterns) available at premium. Check availability in enterprise portal. One-time premium plus standard charges."
What happens if I exceed my data limit?,"Speed reduces to 64kbps for prepaid or 128kbps for postpaid. Purchase data addon or wait for plan renewal to restore full speed. No extra charges for overage."
How do I check remaining validity?,"Check in app under Plan Details or dial *123#. Shows plan name, remaining days, data balance, and renewal date."
Can I downgrade my plan?,"Yes. Downgrade effective from next billing cycle. No refund for current cycle. Some promotional plans cannot be downgraded."
What is the minimum contract period?,"Prepaid has no contract. Postpaid minimum 1 month. Enterprise contracts typically 12-24 months with early termination fees."
How do I cancel my connection?,"Submit cancellation request in app or visit store with ID. Postpaid requires clearing outstanding dues. Number deactivates within 24 hours."
Is there a cancellation fee?,"No fee for prepaid. Postpaid has no fee after first month. Enterprise accounts have contract-specific termination clauses."
How do I recharge for someone else?,"Enter recipient's number in recharge section. Payment from your account, benefits to their number. Works for any number on the network."
What is auto-renewal?,"Prepaid plans auto-renew if sufficient balance exists. Disable in app under Plan Settings. Postpaid always auto-renews with invoice."
How do I stop auto-renewal?,"Disable in app under Plan > Auto-renewal toggle. Plan expires at end of validity without renewal. Reactivate anytime."
Can I pause auto-renewal temporarily?,"Yes. Set pause duration in app. Auto-renewal resumes after pause period. Number remains active during pause if validity exists."
What payment methods are accepted?,"UPI, credit/debit cards, net banking, wallets (Paytm, PhonePe, Amazon Pay), and cash at retail stores."
Is there a convenience fee for payments?,"No fee for UPI and net banking. Cards may have 1-2% fee depending on bank. Wallets have no fee."
How do I get payment receipt?,"Receipts auto-sent to registered email. Download from app under Payments > History. GST invoice available for business accounts."
What is the GST on telecom services?,"18% GST applies to all telecom services. Included in displayed prices. GST invoice available for input credit claims."
How do I update GST details for business?,"Add GSTIN in Profile > Business Details. GST invoice generated automatically. Changes reflect from next billing cycle."
Can I get consolidated invoice for multiple numbers?,"Yes for corporate accounts. Family plans get single invoice. Individual postpaid numbers have separate invoices."
What is balance transfer?,"Transfer talk-time balance to another prepaid number. Dial *balance*recipient*amount#. Rs 2 fee per transfer. Daily limit Rs 200."
How do I check balance transfer history?,"View in app under Payments > Transfers. Shows sent and received transfers with timestamps and transaction IDs."
Can I reverse a balance transfer?,"No. Transfers are instant and irreversible. Verify recipient number before confirming. Contact support for disputes."
What is the validity of transferred balance?,"Transferred balance inherits recipient's current validity. No separate validity for transferred amount."
How do I activate night data pack?,"Purchase Night Data addon from app. Active 12AM-6AM daily. Unlimited data during night hours. Regular data used outside window."
What is weekend data pack?,"Unlimited data on Saturday and Sunday. Purchase from addons section. Valid for 4 weekends from activation."
Are there any student-only plans?,"Student plans offer 15% discount on select prepaid packs. Verify with valid student ID annually. Available for ages 16-25."
What is the senior citizen benefit?,"10% discount on postpaid plans for 60+ age. Submit age proof once. Discount applies automatically to all future bills."
Is there military/veteran discount?,"15% discount for active military and veterans. Submit service ID for verification. Applies to postpaid plans only."
What is the government employee plan?,"Special corporate rates for government employees. Enroll through department HR. Requires official email verification."
How do I gift a recharge?,"Select Gift Recharge in app. Choose plan and recipient number. Pay and plan activates on recipient's number immediately."
Can I schedule a gift recharge?,"Yes. Set future date for gift activation. Payment charged immediately. Gift delivered on scheduled date with custom message."
What is the referral bonus?,"Refer friends, earn Rs 50 when they activate. Referred user gets Rs 25. No limit on referrals. Bonus credited within 48 hours."
How do I track my referrals?,"View in app under Rewards > Referrals. Shows pending, successful, and credited referrals with amounts."
What is the loyalty program?,"Earn 1 point per Rs 10 spent. Redeem for data, plans, or partner vouchers. Points expire after 12 months of inactivity."
How do I redeem loyalty points?,"Go to Rewards > Redeem. Browse catalog and select reward. Points deducted instantly. Digital rewards delivered immediately."
Can I transfer loyalty points?,"No. Points are non-transferable and linked to your account. Use before account closure or they're forfeited."
What is priority customer service?,"Postpaid Premium and Enterprise get priority queue. Average wait under 2 minutes. Dedicated relationship manager for enterprise."
How do I reach customer service?,"App chat 24/7, helpline 198 (toll-free), email support@telecom.com, or visit nearest store. Response within 4 hours for tickets."
What languages does support offer?,"Support available in English, Hindi, and 10 regional languages. Select preferred language in app settings."
How do I file a complaint?,"Submit via app Support section. Include issue details and screenshots. Ticket number provided for tracking. Resolution within 7 days."
What if complaint is not resolved?,"Escalate via app after 7 days. Senior management review within 48 hours. Appellate authority contact available for regulatory escalation."
How do I check complaint status?,"Track in app under Support > My Tickets. Shows status, updates, and expected resolution time."
What is the network coverage area?,"Coverage spans all major cities and 95% of highways. Rural coverage expanding. Check coverage map in app for specific locations."
How do I report coverage gaps?,"Report via app with location pin. Field team surveys within 7 days. Coverage improvement prioritized based on demand."
What is indoor coverage solution?,"Femtocell devices available for poor indoor coverage. One-time purchase Rs 2999. Connects to broadband for enhanced indoor signal."
How do I get femtocell device?,"Order from app or store. Requires active postpaid connection and broadband. Installation guide included. Support available for setup."
What is the network maintenance schedule?,"Maintenance typically 2-5 AM on weekdays. Advance notice via SMS for planned outages. Emergency maintenance notified immediately."
How do I check for outages in my area?,"Network Status in app shows real-time outages. Enter location for specific status. Estimated restoration time displayed."
What is the compensation for outages?,"Credit of 1 day service for every 4 hours of unplanned outage. Auto-credited to next bill. No claim needed."
How do I backup my contacts to cloud?,"Enable Contact Backup in app settings. Syncs automatically. Restore to new device by logging into same account."
Is cloud backup free?,"Basic backup (contacts, SMS) free. Media backup requires premium subscription Rs 49/month for 50GB cloud storage."
How do I transfer data to new phone?,"Use Transfer Wizard in app. Works between any smartphones. Transfers contacts, photos, apps, and settings wirelessly."
What is eSIM activation process?,"Request eSIM in app. Complete verification. Receive QR code via email. Scan with new device. Physical SIM deactivates automatically."
Can I have both eSIM and physical SIM active?,"Not for same number. One number = one active SIM (physical or eSIM). Dual SIM phones can have different numbers on each."
How do I switch back from eSIM to physical SIM?,"Request physical SIM in app. Collect from store with ID. eSIM deactivates when physical SIM activates."
What devices support eSIM?,"iPhone XS and later, Google Pixel 3 and later, Samsung Galaxy S20 and later, and select other flagships. Check device specs."
What is the international roaming activation time?,"Instant for postpaid with roaming pack. Prepaid requires 24-hour advance activation. Enable roaming in device settings."
Which countries have roaming partnerships?,"200+ countries covered. Full list in app under Roaming > Countries. Rates vary by country and pack purchased."
What if I don't buy roaming pack?,"Pay-per-use rates apply. Significantly higher than pack rates. Data Rs 10/MB, calls Rs 50/min. Buy pack to save."
How do I check roaming usage in real-time?,"Usage alerts sent via SMS while roaming. Check app when on WiFi. Detailed breakdown in billing section."
Can I set roaming spend limit?,"Yes. Set limit in app under Roaming > Spend Control. Service pauses when limit reached. Increase limit anytime."
What is WiFi calling roaming behavior?,"WiFi calls while abroad charged as local calls to India. Uses WiFi, not roaming data. Best option for international calls."
How do I enable airplane mode with WiFi?,"Enable airplane mode, then turn on WiFi separately. Allows WiFi calling without cellular charges while abroad."
What is the data roaming warning?,"Alert at 50MB and 100MB usage while roaming. Disable data roaming in settings to avoid accidental usage."
How do I block data roaming?,"Settings > Mobile Network > Data Roaming > Off. Prevents all mobile data abroad. WiFi still works."
Can I use my plan data while roaming?,"No. Domestic data doesn't work abroad. Must purchase roaming pack or pay per-use rates."
What is the call forwarding charge while roaming?,"Forwarded calls charged international rate to forwarding destination plus roaming incoming rate. Can be expensive."
How do I avoid bill shock while roaming?,"Buy roaming pack before travel. Set spend limits. Use WiFi calling. Disable data roaming. Monitor usage via SMS alerts."
What is the emergency number while abroad?,"112 works globally for emergencies. Local emergency numbers also work. Calls free even without balance or roaming pack."
How do I get local number while traveling?,"Purchase travel SIM from destination country. Or use eSIM travel plans from third-party providers. Keep home SIM for verification SMS."
What is dual SIM standby mode?,"Both SIMs active for calls/SMS but only one for data at a time. Switch data SIM in settings. No calls missed on either number."
How do I set call forwarding between my two numbers?,"Forward calls from secondary to primary when busy/unreachable. Dial *21*primary_number# from secondary SIM."
What is the USSD code for balance check?,"Dial *123# for prepaid balance. Shows talk-time, data, SMS balance, and validity. Free service."
What is the USSD code for data balance?,"Dial *121# for detailed data balance. Shows main pack data, bonus data, and night data separately."
What is the USSD code for last 5 transactions?,"Dial *124# for recent transaction history. Shows recharges, deductions, and balance transfers."
How do I check my own number via USSD?,"Dial *1# to receive SMS with your own number. Useful when you forget your number."
What is the USSD code for customer care?,"Dial 198 for toll-free customer care. Or dial *199# for callback request. Available 24/7."
How do I activate DND via USSD?,"Send START DND to 1909. Or dial 1909 and follow IVR prompts. Activation within 24 hours."
What is the USSD code for plan details?,"Dial *125# for current plan details. Shows plan name, benefits, validity, and renewal date."
How do I check offer eligibility via USSD?,"Dial *126# for personalized offers. Shows available upgrades and special packs based on usage pattern."
